{
  "screenId": "BO006",
  "screenName": "상품목록",
  "purpose": "등록 상품을 조건 검색하고 목록 조회·일괄적용(판매기간/뱃지/재고/브랜드)한다",
  "menuPath": "상품관리 > 상품목록",
  "portal": { "portal": "admin", "section": "product" },
  "sourceRef": "SSTM_BO_20230828.pptx",
  "cases": [
    { "group": "일괄적용 영역", "options": ["열기", "닫기"] },
    { "group": "상품코드 클릭 진입", "options": ["일반→상품등록", "개인결제→개인결제상품등록"] }
  ],
  "proc": [
    { "step": 1, "flow": "검색조건 입력 → [조회] → 상품목록 그리드 표시(기본 50건/페이지)" },
    { "step": 2, "flow": "[일괄적용 열기] → 체크 상품에 판매기간/뱃지/재고/브랜드 일괄 반영 → 확인창 → 재조회" },
    { "step": 3, "flow": "상품코드 클릭 → 개인결제면 개인결제상품등록, 일반이면 상품등록으로 이동" }
  ],
  "policy": [
    "일괄적용 후 저장완료·재조회 시 체크 항목 유지",
    "재고 일괄적용은 옵션 없는 상품만 적용(옵션 있으면 경고)",
    "판매기간 시작일 ≤ 종료일(YYYYMMDD 8자리), 재고 숫자 양수 10자리"
  ],
  "sections": [
    {
      "no": 1, "title": "검색 조건", "kind": "search",
      "fields": [
        { "marker": "a", "label": "브랜드", "type": "popup", "sourceId": "slide38#2", "note": "돋보기→브랜드 조회 팝업, 복수선택, 콤마 구분 입력" },
        { "marker": "b", "label": "개인결제상품여부", "type": "radio", "sourceId": "slide38#4", "note": "Y/N/전체 [추가개발 3차]" },
        { "marker": "c", "label": "카테고리", "type": "category", "sourceId": "slide38", "note": "대>중>소>세 분류" },
        { "marker": "d", "label": "판매가·등록일자 범위", "type": "pricerange", "sourceId": "slide38", "note": "금액/날짜 from~to" }
      ]
    },
    {
      "no": 2, "title": "상품 목록", "kind": "list",
      "fields": [
        { "marker": "a", "label": "상품코드(바로가기)", "type": "readonly", "sourceId": "slide38#5", "note": "클릭 시 개인결제/일반 분기 이동" },
        { "marker": "b", "label": "브랜드명(한글)/(영문)", "type": "readonly", "sourceId": "slide38#3", "note": "한·영 병기" },
        { "marker": "c", "label": "일괄적용 영역", "type": "checkbox", "sourceId": "slide39#1", "note": "판매기간/뱃지/일괄재고없음/브랜드 일괄 반영" }
      ]
    }
  ],
  "tables": [
    {
      "title": "상품 목록",
      "columns": ["No","상점ID","상품이미지","상품코드","상품명","브랜드명(한/영)","개인결제","아울렛판매가","추가할인가","배송비","재고","판매","품절","뱃지","등록일자"],
      "dummyRowsRef": "shinsegae-simon-bo/더미캐스트#brands",
      "sourceId": "slide38"
    }
  ],
  "messages": [
    { "type": "확인", "text": "판매기간 일괄적용 처리 하시겠습니까?", "condition": "[판매기간 적용] 클릭", "sourceId": "slide40#1" },
    { "type": "확인", "text": "뱃지유형 일괄적용 처리 하시겠습니까?", "condition": "[뱃지 적용] 클릭", "sourceId": "slide40#2" },
    { "type": "확인", "text": "일괄재고없음 적용하시겠습니까?", "condition": "[일괄재고없음 적용] 클릭", "sourceId": "slide40#3" },
    { "type": "경고", "text": "재고 일괄적용처리는 옵션있는 상품의 경우 처리 불가합니다.", "condition": "재고 일괄적용 시 옵션 있는 상품 선택", "sourceId": "slide40#3-1" },
    { "type": "확인", "text": "브랜드 일괄적용 처리 하시겠습니까?", "condition": "[브랜드 적용] 클릭", "sourceId": "slide40#4" }
  ],
  "dummyCastRef": "projects/shinsegae-simon-bo/docs/00_INDEX.md#고정-더미-캐스트"
}
